{
  "available_cash_usd": 3264.31,
  "cash_source": "legacy display only; radar reads stock-strategy-system/portfolio_state.json",
  "candidates": {
    "MVLL": {"validation": {"status": "UNVALIDATED", "evidence_packet_validated": false, "deterministic_gate_status": "NOT_RUN", "risk_controller_status": "NOT_RUN"}, "thesis_status": "UNVERIFIED", "valuation_status": "UNVERIFIED", "risk_liquidity_status": "CONSTRAINED", "portfolio_fit_status": "CONSTRAINED", "remaining_conditions": ["THESIS_RESEARCH", "VALUATION_REFRESH"], "next_review_trigger": "INDEPENDENT_COMPLETED_CLOSE"},
    "SOXL": {"validation": {"status": "UNVALIDATED", "evidence_packet_validated": false, "deterministic_gate_status": "NOT_RUN", "risk_controller_status": "NOT_RUN"}, "thesis_status": "UNVERIFIED", "valuation_status": "UNVERIFIED", "risk_liquidity_status": "CONSTRAINED", "portfolio_fit_status": "CONSTRAINED", "remaining_conditions": ["THESIS_RESEARCH", "VALUATION_REFRESH"], "next_review_trigger": "INDEPENDENT_COMPLETED_CLOSE"},
    "NBIS": {"validation": {"status": "UNVALIDATED", "evidence_packet_validated": false, "deterministic_gate_status": "NOT_RUN", "risk_controller_status": "NOT_RUN"}, "thesis_status": "UNVERIFIED", "valuation_status": "UNVERIFIED", "risk_liquidity_status": "CONSTRAINED", "portfolio_fit_status": "UNVERIFIED", "remaining_conditions": ["THESIS_RESEARCH", "VALUATION_REFRESH"], "next_review_trigger": "INDEPENDENT_COMPLETED_CLOSE"},
    "BE": {"validation": {"status": "UNVALIDATED", "evidence_packet_validated": false, "deterministic_gate_status": "NOT_RUN", "risk_controller_status": "NOT_RUN"}, "thesis_status": "UNVERIFIED", "valuation_status": "UNVERIFIED", "risk_liquidity_status": "CONSTRAINED", "portfolio_fit_status": "UNVERIFIED", "remaining_conditions": ["THESIS_RESEARCH", "VALUATION_REFRESH"], "next_review_trigger": "INDEPENDENT_COMPLETED_CLOSE"},
    "TOST": {"validation": {"status": "UNVALIDATED", "evidence_packet_validated": false, "deterministic_gate_status": "NOT_RUN", "risk_controller_status": "NOT_RUN"}, "thesis_status": "UNVERIFIED", "valuation_status": "UNVERIFIED", "risk_liquidity_status": "CONSTRAINED", "portfolio_fit_status": "UNVERIFIED", "remaining_conditions": ["THESIS_RESEARCH", "VALUATION_REFRESH"], "next_review_trigger": "INDEPENDENT_COMPLETED_CLOSE"},
    "NOW": {"validation": {"status": "UNVALIDATED", "evidence_packet_validated": false, "deterministic_gate_status": "NOT_RUN", "risk_controller_status": "NOT_RUN"}, "thesis_status": "UNVERIFIED", "valuation_status": "UNVERIFIED", "risk_liquidity_status": "CONSTRAINED", "portfolio_fit_status": "UNVERIFIED", "remaining_conditions": ["THESIS_RESEARCH", "VALUATION_REFRESH"], "next_review_trigger": "INDEPENDENT_COMPLETED_CLOSE"},
    "FSLY": {"validation": {"status": "UNVALIDATED", "evidence_packet_validated": false, "deterministic_gate_status": "NOT_RUN", "risk_controller_status": "NOT_RUN"}, "thesis_status": "UNVERIFIED", "valuation_status": "UNVERIFIED", "risk_liquidity_status": "CONSTRAINED", "portfolio_fit_status": "UNVERIFIED", "remaining_conditions": ["THESIS_RESEARCH", "VALUATION_REFRESH"], "next_review_trigger": "INDEPENDENT_COMPLETED_CLOSE"}
  },
  "deep_research_results": {}
}
